{
  "$schema": "http://json-schema.org/draft-07/schema#",
  "$id": "schema-playback-state.json",
  "title": "Playback State",
  "description": "Persistent playback position, mode, and decoder failure state",
  "type": "object",
  "required": ["_schema_version", "mode"],
  "properties": {
    "_schema_version": { "const": "1.0" },
    "mode": {
      "type": "string",
      "enum": ["RADIO", "LOCAL", "TRANSITIONING", "IDLE", "BLOCKED_LICENSE"]
    },
    "playing": { "type": "boolean" },
    "source": {
      "type": "string",
      "enum": ["STREAM", "STAGING_CACHE", "CACHE", "IDLE"]
    },
    "process": {
      "type": "object",
      "required": ["pid", "start_ticks", "lease_expires_at"],
      "properties": {
        "pid": { "type": "integer", "minimum": 1 },
        "start_ticks": { "type": "integer", "minimum": 1 },
        "lease_expires_at": { "type": "string", "format": "date-time" }
      },
      "additionalProperties": false
    },
    "output": {
      "type": "object",
      "required": ["available", "updated_at"],
      "properties": {
        "available": { "type": "boolean" },
        "type": { "type": ["string", "null"] },
        "sink": { "type": ["string", "null"] },
        "device": { "type": ["string", "null"] },
        "reason": { "type": ["string", "null"] },
        "updated_at": { "type": "string", "format": "date-time" }
      },
      "additionalProperties": false
    },
    "radio": {
      "type": "object",
      "properties": {
        "last_check": { "type": ["string", "null"], "format": "date-time" },
        "last_hash": { "type": ["string", "null"] },
        "consecutive_failures": { "type": "integer", "minimum": 0 }
      },
      "additionalProperties": false
    },
    "local": {
      "type": "object",
      "properties": {
        "playlist_hash": { "type": ["string", "null"] },
        "playlist_id": { "type": ["string", "null"] },
        "current_track_index": { "type": "integer", "minimum": 0 },
        "current_track_id": { "type": ["string", "null"] },
        "current_track_url": { "type": ["string", "null"] },
        "position_seconds": { "type": "integer", "minimum": 0 },
        "last_updated": { "type": "string", "format": "date-time" },
        "consecutive_failures": { "type": "integer", "minimum": 0 }
      },
      "additionalProperties": false
    },
    "statistics": {
      "type": "object",
      "properties": {
        "total_plays": { "type": "integer", "minimum": 0 },
        "mode_switches": { "type": "integer", "minimum": 0 },
        "last_server_contact": { "type": ["string", "null"], "format": "date-time" }
      },
      "additionalProperties": false
    },
    "decoder_failure": {
      "type": "object",
      "properties": {
        "last_error": { "type": "string" },
        "decoder_exit_code": { "type": "integer", "minimum": 1 },
        "failed_track_id": { "type": ["string", "null"] },
        "failed_track_url": { "type": ["string", "null"] },
        "failed_local_path": { "type": ["string", "null"] },
        "failure_source": { "type": "string", "enum": ["RADIO", "LOCAL"] },
        "consecutive_failures": { "type": "integer", "minimum": 1 },
        "failure_at": { "type": "string", "format": "date-time" },
        "playing": { "const": false }
      },
      "additionalProperties": false
    }
  },
  "additionalProperties": false
}
