{
  "_schema_version": "1.0",
  "mode": "RADIO",
  "playing": false,
  "source": "IDLE",
  "radio": {
    "last_check": "2026-07-09T12:00:00Z",
    "last_hash": "sha256:abc123",
    "consecutive_failures": 0
  },
  "local": {
    "playlist_hash": "sha256:8f14e45f",
    "playlist_id": "pl_abc123",
    "current_track_index": 7,
    "current_track_id": "track_007",
    "current_track_url": "/tracks/track_007.mp3",
    "position_seconds": 45,
    "last_updated": "2026-07-09T12:05:00Z",
    "consecutive_failures": 0
  },
  "statistics": {
    "total_plays": 1234,
    "mode_switches": 5,
    "last_server_contact": "2026-07-09T12:00:00Z"
  },
  "decoder_failure": {}
}
